goal,steps,ordered?
How to Find Your Perfect Match - Knowing What You Deserve,Make a list. Think about what you will gain. Look for the qualities you respect.,0
How to Obtain Free Employment Verification of Someone - Using an Employment Verification Letter,Understand what a verification letter is. Ask for a letter. Accept a character reference as a substitute.,0
How to Get a Dog to Listen - Using a Dog’s Name to Get Its Attention,Say the dog’s name clearly. Use a kind tone. Offer a treat when you say the dog’s name.,1
How to Help Curb the Effects of Global Warming,"Do not cut down trees and shrubs unnecessarily. Change from being a paper-intensive to being a paper-free organization, hospital, office, etc. Avoid using or purchasing commodities stored in plastic bottles or containers as these plastic containers use up large amounts of crude oil in order to be manufactured. Switch off electrical appliances and lights when not needed, or when leaving home. Do not burn garden refuse or any plastic material. Recycle as much as possible. Encourage environmentally friendly behaviors and children need to made aware of the do's and do not of helping preserve the environment. Do not use candles or burn fires if possible. If possible use public transport when traveling to work or running errands. Change trends from using wooden and hard plastic furniture to naturally built stone or cement fixtures. Convert unused outdoor spaces into a green haven. Adopt a fervent stance in an attempt to make these changes.",0
How to Clean a MacBook Pro Keyboard - Cleaning and Disinfecting the Keyboard Surface,"Dust the surface of your keyboard with a lint-free cloth. Use disinfectant wipes to clean the surface of your keyboard. Use a damp microfiber cloth and wipe down the keyboard. Dry your keyboard with a dry, lint-free, microfiber cloth.",0
How to Decorate Your Cell Phone - Doing Temporary Designs,Cover a clear or colored plastic cell phone case with washi tape. Decorate your phone with stickers if you prefer something simple. Try self-adhesive rhinestones if you want non-permanent bling. Use a clear case and printed images for an interchangeable design. Stylize your phone with themes and wallpapers. Add charms to your phone for something cute and simple.,0
How to Help Your Community Be a Safer One - Engaging With Others in Your Community,Get to know your neighbors. Participate in a community building initiative. Get to know your local police. Spend time outdoors. Prioritize accessibility for all residents.,1
How to Stay Informed About Current Events - Interpreting the News,"Fact-check news sources and partisan claims. Find a mix of local, national, and global news coverage. Investigate issues of special concern to you.",0
How to Reduce Anxiety Associated with Social Media Addiction - Limiting Your Social Media Use,Set a timer every time you start using social media. Post updates without making comparisons. Be selective of what you share. Reflect before responding to comments. Limit interactions to friends and relatives. Spend time with friends in real life.,0
How to Undo a Bra One Handed - Familiarizing Yourself with a Bra,Find a bra you can use for practice. Check out the mechanism that keeps a bra fastened. Practice unhooking the bra with one hand.,1
How to Add a Color Palette in Photoshop from a Photograph - Using the Palette,Open the photo that you want to color. Be sure that your Swatches window is showing. Click on the tiny icon with 4 lines and then Load Swatches. Find and select the palette that you just created. Look at your swatches.,1
How to Read Google Books,"Go to the classic Google Books website or the new one. Search for a book or magazine's title, author, ISBN, or keywords. Click a title. Click Read for free or Preview.",1
How to Be an Effective Public Speaker - Giving Your Presentation,Mingle with the audience members before you give your speech. Review your notes before your speech. Articulate your words. Use gestures to emphasize your points. Adjust to follow the audience’s reaction. Use audio-visual aids only as needed. Involve the audience. Be yourself. Calm yourself if you start to feel nervous.,1
How to Stay Active with Psoriatic Arthritis - Doing Aerobic Exercises,Walk more often. Ride a bike. Go swimming. Try cross-country skiing. Try tai chi. Try yoga. Engage in social dancing. Try a sport. Find ways to incorporate physical activity into your daily routine.,0
How to Hide a Lip Piercing from Parents or Bosses - Concealing Getting the Piercing,Check your state's laws. Consider when to get the piercing. Choose a clear bioplast loop or stud for the piercing.,1
How to Avoid Confusion in Study and Work,"Have an ""Ah Ha"" moment. Decide some areas of your abilities and things that are  interesting to learn. Keep up your stamina and enthusiasm in the areas of your strengths and interests to find your best abilities and greatest opportunities that will fit your personality. Focus mainly on one thing -- one at one time, and not much else, and let almost every ounce of effort go into that so that it will become a real area of strength -- not confusion. Keep on doing what you decided to do. Improve yourself and your chances and you will not be confused. Do not stop and start--or quit halfway through--because if you do not accept or reject theories or ideas blindly, then you can be clear about your purposes and keep going. Continue to build your strength of faith and your ability to learn and to earn -- with faith in your ability to improve abilities and skills by being persistent and reliable -- believing that you're blessed. Follow-through: stopping halfway is confusing and shows a pattern of mixed up thinking.",1
How to Feel Amazing - Feeling Physically Amazing,Take care of personal hygiene. Get some exercise. Eat healthily. Get enough sleep.,0
How to Cure Astigmatism - Getting Laser Eye Surgery,Get a referral for a specialist eye clinic from your optometrist. Learn the possible risks of laser eye surgery. Allow the eye surgeon to perform laser eye surgery. Recover after the surgery.,1
How to Glorify God (Christianity),"Take the Good News: Go into the world--first outside your gate--and teach/preach the Gospel to every creature; thus you glorify the Lord. Lift up the Lord: Lift Him up on high. Bow down: let us kneel before the LORD our Maker. Worship the Father in spirit and in truth: [not in word or deed only] for the Father seeks such to worship Him. Sing songs of his statutes in the house of your pilgrimage, and remember the name of the LORD, in the night, keeping His law. Give unto the LORD the glory due unto His name: and bring an offering when you come into His courts. Fear [revere] Him, in all your ways, and worship the LORD in the beauty of holiness. Magnify Him: Armies can't defeat Him; science can't explain Him, leaders can't ignore Him! Acknowledge Him in all your ways: New Age religion can't replace Him, and no one can ever explain Him away! Work God's Plan: The Lord is the One who shelters his own and finds them precious. Do not be slothful in business, but do all things as to the Lord, and glorify Him. Love others, especially fellow Christians: Loving others will testify to how authentic your faith is: ""By this shall you know that you are my disciples, if you love one another!"" Proclaim that Jesus Saves and that God is eternal -- and so He is outside of time constraints: God has no beginning and has no end. Be Happy. Let your light so shine before men, that they may see your good works, and glorify your Father which is in heaven. Bring glory to God by receiving the  baptism of the Holy Spirit.",1
How to Ride a Bike Safely - Checking your bike,Check your cycling equipment. Check the brakes. Check the bike's tires. See if the bike is the right height for you.,0
How to Submit a Link to a Web Directory,"Select the category that fits the website topic. After choosing the category, click the submit link button this will open a Submission request form page. After filling the form, click continue/ Submit site. Then a Message will be displayed as Link: submitted and awaiting approval. Submit another link. Finally save the URL of the page where the link will be submitted for future reference.",1
How to Join the American Federation of Government Employees - Using Union Benefits,Take advantage of many home benefits. Obtain health care discounts. Receive discounted legal services. Enjoy entertainment discounts. Get travel discounts. Learn about other union benefits.,0
How to Start a Graphic Design Business - Building Your Clientele,Develop a marketing plan that includes a strong online presence. Trust your instincts and be true to yourself. Avoid taking on clients without signed contracts.,1
How to Cook Hot Dogs - Frying Hot Dogs,Cut up some hot dogs. Heat some oil in a frying pan. Place the hot dog pieces in the frying pan. Turn the hot dog pieces. Drain the hot dog pieces. Serve the hot dogs.,0
How to Type in Korean on Android,Open an app that allows you to type. Tap the typing area. Tap the keyboard settings icon. Tap Languages. Tap ADD KEYBOARD. Scroll down and tap Korean. Select your desired layout. Tap DONE. Open the keyboard again. Tap and hold the globe key. Tap Korean.,0
How to Learn to Accept a Gay Marriage - Discussing Same-Sex Marriage,Discuss same-sex marriage with your loved ones and friends. Have a conversation with other people who have worked to accept same-sex marriage. Seek out other advice. Research same-sex marriage.,1
How to Hug Your Boyfriend - Hugging Your Boyfriend Properly,"Make sure that you look good and smell nice. Step forward and put your left arm between his right arm and side of his body. Raise your right arm and place it on the back of his neck. Gently squeeze him, and press your body against his. Hold the hug for a few seconds. Hug your boyfriend differently than you would hug your friend. Know what makes a great hug.",0
How to Improve Sperm Morphology - Using Nutrition,"Follow a healthy diet to get more sperm-protecting nutrients. Eat 2 to 3 servings per day of foods that are rich in Vitamin C. Vitamin C has been shown to promote the overall quality of sperm, including sperm morphology, so make sure that you eat plenty of vitamin C-rich foods every day. Consume 2 to 3 daily servings of vitamin E-rich foods. Get lycopene from 2-3 daily servings of tomatoes and tomato products. Use olive oil instead of other types of fat.",1
How to Make a Tight Turn Quickly in a Car - Using Your Handbrake,Practice this turn in an open space that's free of obstructions. Drive into the turn at a fast speed. Push down on the clutch while pulling on the handbrake in a manual car. Turn your wheel into the turn. Push your handbrake down and let the wheel spin in the other direction. Turn back into the direction of the turn.,0
How to Stretch the Calf Area of Boots - Stretching Boots with Boot Bands,Purchase 2 boot bands. Clip the pullers onto each side of your zip. Place the boot band zip next to the zip on your boot. Pull the zipper up to connect the boot band to your boot. Line up the other side of the boot band zip next to the boot zip and pull it up.,1
How to Learn Hypnosis - Mastering a Hypnotic Routine,Gain the other person’s attention with a story or task. Reach the person’s unconscious mind with a story. Watch for your subject’s body to relax. Direct the person’s behavior by describing a meaningful scene. Tell the subject to move again so they exit the trance.,1
How to Decorate a Hall for a Wedding - Hanging Decor from the Ceiling,"Set the mood of the evening with hanging lighting. Hang bunting for a classic, cheerful decor option. Criss-cross colorful paper streamers across the ceiling for a playful look. Hang flowers from the ceiling to bring the outdoors in. Drape fabric from the ceiling for a dramatic effect.",0
How to Fight Fast - Warming up Correctly,Put in the time. Practice some dynamic stretches. Get your head in the game. Come prepared to practice.,0
How to Buy Everything You Need for Your Doll - Getting the things,Ask your parents to come shopping with you when you buy all the stuff for your doll! If you want to take your doll on trips then make sure you buy a little bag to keep all the things they definitely need and a bigger bag for all their clothes. Remember to look after your doll.,0
How to Crack Your Upper Back - Taking Safety Precautions,See a doctor if you have persistent back pain. Do not crack your back too often. Opt for stretches over cracking you back.,1
How to Replace a DC Jack in a Laptop - Re-Assembly,Place motherboard in place in the chassis that it was taken from before flipping it over. Reconnect all cords to the motherboard. Screw in the fan and plug in its cord. Re-attach the face plate. Plug in the keyboard. Screw in screws to the back of the laptop. Insert DVD drive. Insert RAM cards. Insert the hard drive. Cover the RAM cards and hard drive with their respective doors and screw those in. Troubleshoot as needed:,1
How to Prepare the House for Christmas - Decorating the House,Put up a Christmas tree. Set out festive decorations. Make and display homemade decorations. Decorate the outside of your house.,1
How to Peel a Kiwi - Peeling kiwifruit with a spoon,"Cut off both ends of the kiwifruit using a serrated paring knife. Slip a spoon in between the skin and the flesh of the fruit (a tablespoon is usually a good size of spoon to use). Apply a small amount of pressure against the skin and gently turn the kiwifruit with your other hand, scooping the flesh away from the skin.",0
How to Uninstall Google Chrome - On Android,"Open your Android's Settings. Tap Apps. Find and select {""smallUrl"":""https:\/\/www.wikihow.com\/images\/c\/cd\/Android7chrome.png"",""bigUrl"":""https:\/\/www.wikihow.com\/images\/c\/cd\/Android7chrome.png"",""smallWidth"":460,""smallHeight"":460,""bigWidth"":760,""bigHeight"":760,""licensing"":""<div class=\""mw-parser-output\""><p>I edited this screenshot of an Android icon.\n<\/p><p>License: <a rel=\""nofollow\"" class=\""external text\"" href=\""http:\/\/en.wikipedia.org\/wiki\/Fair_use\"">Fair Use<\/a><br>\n<\/p><\/div>""} Chrome. Tap UNINSTALL. Tap UNINSTALL when prompted.",1
How to Use Second Chance Checking,"Learn the features, restrictions and requirements for your account. Monitor deposits, withdrawals and checks written using a checkbook register. Use your debit or ATM card with caution and in accordance with any restrictions implemented by your financial institution. Connect with your banker or customer service representative periodically.",0
How to Watch TV Without Cable - Cancelling Cable Contracts,"Call your cable provider before you have decided to cut the cord. Get recommendations from others who have cut the cable cord. Cancel your cable, but retain your high-speed Internet. Try streaming for at least 3 months before returning to cable. Try a new cable provider if you go back.",0
How to Clean an iMac Screen - Using the Right Materials,Avoid using cleaners with acetone and ammonia. Make your own cleaner using water and white vinegar. Avoid using paper towels to wipe your iMac’s screen.,1
How to Clean a CPAP - Cleaning Your CPAP Mask Daily,Disassemble your headgear. Hand wash the mask with soapy water. Air dry your mask after washing. Consider using CPAP mask wipes.,0
How to Make a Paper Hat - Making a Sailor or Alpine Hat,"Crease a rectangular sheet of paper down the middle. Fold the paper in half widthwise. Fold the top corners to the center crease. Fold 1 of the flaps along the bottom edge up. Fold the brim inwards if it is too wide for you. Flip the paper over and fold the second flap up too. Tape the corners of the brim, if desired. Open the base of the hat to put it on.",0
How to Keep Your Room Tidy - Organizing Your Room,Find a place for everything. Use boxes and baskets for storage. Hang up certain items. Invest in a hanging shoe rack. Clean out your closet. Tidy up drawers. Store items under your bed.,0
How to Write a Mission Statement - Finalizing the Statement,Get other company members involved. Test it out. Revise it when necessary.,0
How to Write a Good Joke - Preparing Material for Jokes,Consider interesting joke material. Research topics for different situations and audiences. Try to avoid controversial topics that might offend someone.,0
How to Make a Vegan Avocado Chocolate Cake,"Preheat the oven to 180ºC/350ºF. Add the flour, salt, baking powder, and baking soda to the mixing bowl. Add the ground hazelnuts. Add the vegetable oil, water, vinegar and vanilla in the other mixing bowl. Add the sugar to the bowl of wet ingredients. Pour the wet ingredients into the dry ingredients bowl. Pour the batter into the prepared cake pan. Place in the oven. Remove from the oven. Ice when cooled.",1
How to Apologize After a Heated Argument - Re-establishing Trust After an Argument,Acknowledge the reason that you had a fight. Include specific realizations about your behavior in conversations following an apology. Address potential causes of continued tension with your loved one. Don’t hold grudges. Commit to acting more appropriately. Give a token of apology. Consummate the apology.,0
How to Set Up a Commercial Kitchen - Purchase and Install Cooking Equipment,"Purchase and install an industrial range hood and H-VAC ventilation system. Purchase or lease a broiler, a gas range and oven, and an industrial salamander. Purchase optional equipment depending on the type and the size of the food service operation.",1
How to Get Rid of Spiders in the House - Verified Pest Control Methods,Vacuum spiders and spider webs. Apply a residual insecticide. Call a professional exterminator.,0
How to Grow Birch Trees - Planting the Birch Tree,"Select a planting location with full sun. Choose a planting location with moist, slightly-acidic soil. Plant the seedling when it reaches 15 to 20 inches (40 to 50 cm) tall. Dig a shallow, wide hole in the ground. Place the seedling in the hole and replace the soil. Soak the seedling roots with water. Mulch with wood chips, leaf compost, or shredded bark.",1
How to Check Traffic - Checking Traffic with Google Maps,"Open Google Maps on your device. Type in your destination. Click “Directions” and enter your starting point. Select “Menu” if you are using the Google Maps website. Tap “Layers” if you are using an app. Select “Traffic.” After you click “Menu” or “Layers,” a set of options will appear, such as Transit, Traffic, Satellite, Terrain, and Biking. Choose the route that Google marks as the fastest.",1
How to Write a CV Summary - Formatting Your Summary,"Place the summary at the top of your CV after your contact information. Type the section heading in bold or caps. Use a readable font set at 10.5 to 12 point. Include 1.5 line spacing in your summary text, if possible. Make sure your formatting and style are consistent. Proofread your CV carefully. Ask a mentor, coworker, friend, or relative to review your CV.",0
How to Be Popular in Private School - Being popular on your terms,Be yourself in every way that you feel is needed. Identify why you want to become popular. Know what you're getting yourself into. Know the time commitment expected. Make a strategy and know your role. Prepare yourself mentally.,0
How to Case Leather - Casing Your Leather,"Place the leather in a dark, sealed container. Check the color of the leather. Hold the leather to your cheek.",0
How to Live With Depression - Understanding Your Depression,Call 911 if you have suicidal thoughts and are at risk. Watch for symptoms of depression. Keep track of your feelings and activities. Monitor yourself if you have the blues.,0
How to Get a Japanese Passport - Getting Your Passport,Choose the type of passport you want. Gather the necessary documents. Fill out the application form at your local Ward Office. Wait 7 to 10 days for your passport.,0
How to Draw Cute Animals - A Cute Tiger,Draw a square. Draw a rectangle on the right bottom side of the square. Draw the four legs of the tiger using small sharp angles. Draw the ears using small triangles. Draw patterns on the tiger’s body. Erase unnecessary lines. Color your drawing.,1
How to Do Glute Exercises for Flat Butts - Adding Weights,Use dumbbells to perform deadlifts. Add dumbbells while using a stair step. Work on a kettlebell swing. Perform bows with a 9 lb (4.1 kg) bar.,0
How to Write a Customer Relationship Management Plan - Writing Your CRM Plan,Consider using a CRM plan template. Summarize the information you gathered. Specify how the business meets or will meet customer needs. Write a plan for customer retention. Construct a policy to handle customer communications. Include financial and time budgets for your CRM plan. Determine who in the company will be responsible for each part of your CRM plan.,1
How to Become a Sports Agent - Preparing to Become A Sports Agent,Know what the job entails. Understand the benefits and drawbacks of a sports agent's work. Be obsessed with sports.,0
How to Prepare for a Mastectomy - Improving Your Comfort During Recovery,"Get loose, comfortable clothing. Set up your bedding with added support. Keep some laxatives on hand. Plan on some activities for your recovery.",1
How to Avoid Uncomfortable Conversations About Religion - Changing the Conversation,Redirect the topic subtly to be polite. Bridge to a safe topic before religion is brought up. Find someone to be a buffer. Respond with total silence.,1
How to Tell a Girl You Don't Like Her - Knowing What Not to Do,Don’t tell other people before you tell her. Don’t tell her in public. Don’t lead her on. Don’t insult her when you reject her. Don’t make stupid excuses. Don’t drag it on.,1
How to Ice Skate - Selecting the Right Materials,Wear lighter clothes. Wear a fitted sweater or a light coat. Find skates that fit properly. Put on socks or tights. Wear a helmet.,0
How to Write an Application Letter - Writing a Job Application,Say why you're writing and what you're applying for in the first sentences. Explain why you are the best candidate. Keep the tone professional. Explain how both parties will benefit from your selection. Do some research.,0
How to Clear Your Browser's Cache - Firefox on Desktop,"Open Firefox. Click ☰. Click Library. Click History. Click Clear Recent History…. Select a time range. Click the ""Details"" drop-down box. Check the ""Cache"" box. Click Clear Now.",1
How to Update Your Vehicle Registration - Changing Your Name,Gather documentation and proof of identity. Complete a vehicle registration application. Visit your local DMV. Submit your documents and fee if required. Receive your updated registration.,0
How to Evaluate an Administrative Assistant - Making Evaluations,Make it part of your daily or weekly job. Fill out the evaluation form. Present the information to the administrative assistant. Reach a mutual agreement about areas that need improvement. Don't review personality. Try secret callers.,0
How to Deal With Your Paranoia - Dealing with Paranoid Thoughts,Start a journal to track your thoughts and feelings. Make a plan to avoid or reduce exposure to your triggers. Learn how to question your thought process. Distract yourself from the paranoid thoughts. Avoid punishing yourself. Determine if you might need professional help.,0
How to Display Hockey Cards - Showing Your High-Value Hockey Cards,Have your top-value cards professionally mounted for private display. Display your important cards in magnetic or screw-tightened cases. Make photocopies of your valuable cards for display purposes.,0
How to Choose Subjects for WACE,"Decide whether you want to do English or Literature. If you already know what university courses you want to do (or at least have a pretty good idea), take a look at their prerequisites. Choose at least one List B subject. Decide whether you want to do a foreign language or not. Choose your other subjects based on what you enjoy and/or what you are good at.",0
How to Write Legal Drafting - Formatting Your Document,Search for forms or samples. Check for agency- or court-specific formatting rules. Set your font and margins. Create your main heading and any subheadings. Outline your document.,0
How to Clean Ears with Peroxide - Setting Up,See your doctor before trying to clean your ears at home. Consider purchasing an earwax-removal kit. Gather your materials. Warm the oil and peroxide.,0
How to Burn Essential Oil - Using a Traditional Oil Burner,Choose a traditional candle burner for its simplicity. Fill the ceramic bowl on the top of your burner with water. Add 10 drops of your essential oils to the water. Insert and light your tea light. Limit the time you burn oils to 30-60 minutes. Wash your burner in between uses to prevent residue build-up.,0
How to Dry a Dog - Drying Your Dog With a Chamois,Use a chamois leather. Rub the dog's coat with the chamois. Wring out the chamois. Be gentle.,0
