goal,steps,ordered?
How to Get Married in Oregon - Planning a Wedding Ceremony,Decide on the type of ceremony. Choose a season. Hire wedding vendors. Confirm the date with vendors and officiants. Make final payments.,1
How to Select a Dog Bed - Understanding Different Types of Beds,Buy a mat for the easiest solution. Pick a pillow bed for a large dog. Select a donut bed if your dog likes to feel secure. Purchase a nest bed for cuddling comfort. Buy a bolster-type bed if your dog is a leaner. Look for a cave-style bed if your dog likes to burrow. Consider a hammock bed for ease of cleaning.,0
How to Live with Atrial Fibrillation - Using Lifestyle Changes,Make things easier. Steer clear of harmful substances. Manage your stress levels. Eat a heart-healthy diet. Quit smoking. Exercise regularly. Take medications.,0
How to Get to Sleep and Feel Refreshed in the Morning - Getting to Sleep,Get comfortable. Cut out stimulants. Turn off the electronics. Stop your racing mind. Keep snacks light before bed. Stay on schedule. Try melatonin. Try a sleep aid. Understand when to see a doctor.,0
How to Train Puggles - House-Training Your Puggle,Begin training your puggle right away. Put your puggle on a training schedule. Clean up any accidents right away. Prepare a crate for your puggle. Teach your dog to use the crate.,1
How to Start a Yeast Free Diet - Trying a Four to Six Week Diet,Familiarize yourself with the foods that are off-limits. Familiarize yourself with the foods that you can eat. Familiarize yourself with treats. Continue this diet for four to six weeks. Slowly add foods back into your diet over a period of a few weeks.,1
How to Have Assault Charges Dropped - Taking Preliminary Steps,Decide why you want to drop the charges. Think over your decision. Seek legal advice. Encourage an abusive partner to get a lawyer.,1
How to Calculate the Volume of a Cube - Finding Volume from Surface Area,Find your cube's surface area. Divide the cube's surface area by 6. Take the square root of this value. Cube this value to find the cube's volume.,1
How to Get Your Crush to Like You in Fifth Grade (Girls),"Say the casual ""Hey"" to get their attention. Play the games outside that they play. Enjoy getting their attention. Work closely with them on school projects. See if you like the things they do. Laugh! Look your best around them. Try to exchange phone numbers, but be casual. Become real friends with the person. Ask them out, if they haven't asked you already!",0
How to Support the ACLU - Taking Action Online,"Go to the ACLU website. Click on the ""Take Action"" tab. Sign a petition. Send a letter to members of Congress. Send a message to private businesses.",1
How to Naturally Treat ADHD - Improving Focus with Organization,Use a daily planner to keep track of your activities and deadlines. Break up large projects into smaller ones. Get rid of clutter because it’s a distraction. Have designated places for important items.,0
How to Be an English Gentleman - Being Chivalrous,"Show politeness to show your refinement. Give up your seat if someone is standing. Hold doors open for people. Take care of people. Mean what you say, and say what you mean.",0
How to Get a Dog to Stop Drinking from the Toilet - Training Your Dog,Catch your dog in the act. Call it from the area. Close the toilet lid. Give your dog a fresh bowl of water.,1
How to Cope With a Bad Dog - Retraining Your Dog,"Avoid rewarding bad behavior. Use clear, simple words like “no,” “bad dog,” and “good dog.” You need to communicate to your dog that it’s engaged in bad behavior and then redirect it to a good behavior and reward it for that behavior. Desensitize your dog to stressful stimuli. Stick to a regular training schedule.",0
How to Teach Mathematics - Working with Students as Individuals,Find ways to challenge upper level students. Provide extra support for slower students. Take a personal interest in all students. Contact parents regularly.,0
How to Identify Songs Using Melody - Using Technology,Find the right app or program for you. Use a music-recognition app. Record yourself humming the melody. Include any additional details you can think of. Post up your query. Wait for an answer.,1
"How to Care for a Fiddle Leaf Fig - Watering, Fertilizing, and Pruning",Water your fiddle leaf fig generously 1-2 times per week. Mist the leaves daily unless the weather is humid. Cut off any leaves that look brown or discolored. Dust the leaves with a damp cloth once every 2 weeks. Check the leaves and stems for pests once per week. Fertilize the plant once in the spring and once per month in the summer.,0
How to Lose Body Fat - Jump-Starting Fat Loss with a New Diet,Consume a well-rounded balance of protein and fat. Drink a lot of water. Eat breakfast every day. Fill your day with fiber. Don't eat foods with empty calories.,0
How to Deal with Misophonia - Finding Your Triggers,Know common misophonia triggers. Notice what sounds cause you to experience stress. Write down what’s happening when you start to feel anxious or upset.,1
How to Buy and Sell Gold Coins for Profit - Selling Gold Coins,Keep track of gold value. Keep track of the value of your country's currency. Aim to sell your coins at the peak of demand. Take your gold coin to a jeweler or pawn shop. Do not sell to “rogue” buyers.,0
How to Choose a Smartphone - Choosing a Smartphone Model,Pick a carrier. Pick a phone service and data plan that works for you. Pick a screen size. Decide how new you want your phone model to be. Check the storage space. Consider camera quality. Consider phone battery life.,0
How to Distress Cabinets - Weathering and Staining Cabinets,"Protect your  work area. Remove knobs, handles, and any other hardware. Sand down the entire surface of the cabinet using a 60 to 80 grit sandpaper. Vacuum your work area and wash the cabinets down to get rid of any dust. Mask off the areas you do not want to be painted with painter's tape. Rub a stain or glaze into the surface of the wood using a piece of cloth. Apply wax or petroleum jelly to the areas you want to distress. Apply a few coats of acrylic or latex furniture-grade paint, letting each layer to dry in between. Lightly sand the cabinet again once the paint is fully dry, and be sure to remove all the dust. Consider applying some antiquing glaze for an aged look. Remove excess glaze, if necessary. Apply three coats of a clear sealer, allowing each coat dry before applying the next one. Make sure that the sealer has fully cured before you replace the hardware on the cabinets.",1
How to Have Good Manners (Girls),Don`t always think about yourself. Manners help people get along together. Good impressions always lead up to good judgments by people. Choose your words carefully. Eat appropriately.,0
How to Stay Friends With a Guy Friend That Asked You Out - Setting Boundaries If He Won't Take No For an Answer,Keep texting to a minimum. Avoid being alone with him. Avoid being physically affectionate. Avoid intimate conversations. Talk on the phone as little as possible. Go to girlfriends to vent or cry.,0
How to Buy Healthy Food on a Budget - Familiarize Yourself with Various Markets,Shop in bulk for items that you know will be used before the expiration date. Discover ethnic markets. Venture over to some discount food stores to see if there are any possible sale items that might be worth a try. Shop at local farmers markets to find healthier options and more savings.,0
How to Use a GoPhone Plan With an iPhone - iPhone through iPhone 3GS,Get an old AT&T iPhone. Get a prepaid AT&T GoPhone. Power down your iPhone. Remove the iPhone SIM card. Remove the GoPhone SIM card. Replace the iPhone SIM card. Make a call. Enable wireless data.,1
How to Bake Eggs - Making Shirred Eggs,"Preheat your oven to 425 °F (218 °C). Grease a muffin tin with a light coat of cooking spray. Crack 1 egg into each muffin tin or ramekin. Pour 1 to 2 teaspoons of heavy cream over each egg. Season the eggs with salt, pepper, and grated cheese, if desired. Bake the eggs for 7 to 12 minutes. Serve the eggs as soon as you take them out of the oven.",1
How to Install Internet Explorer - Using Windows 10,Check to see if you already have Internet Explorer. Go to Microsoft's Internet Explorer page. Scroll down and click Download Internet Explorer 11 (32/64-bit). Press Ctrl+J in your web browser. Click the file that begins with EIE11_EN. Click Yes to confirm. Click Install. Click Restart now.,1
How to Update Your Browser - Updating Apple Safari on Mac OS X,"Click on the Apple menu and select “System Preferences.” Click on “App Store"" and then ""Show Updates.” The Updates window will display on-screen. Browse the list of updates to locate updates for your Safari browser. Click on the “Update” button next to the Safari update. Type in the administrator password for your Mac computer at the prompt.",1
How to Write a Hypothesis for an Essay - Composing the Hypothesis,"Begin by organizing your research. Look at previous studies that focus on what you want to do. Determine what part of the experiment you will manipulate. Based on your research, predict how the experiment will turn out. Write a formal hypothesis. Be as specific as possible. Have someone read over your hypothesis.",1
How to Cook Freekeh - Freekeh Pilaf,"Sauté the onions. Soak the freekeh in cold water. Drain the freekeh. Add the freekeh and spices to the onion. Add the stock, salt, and pepper. Simmer for 15 minutes. Let stand. Mix the yogurt, lemon juice, and garlic. Stir the herbs into the pilaf. Serve with yogurt and pine nuts.",1
How to Become a Singer or Actress As a Teenager - Practicing Your Craft,Invest in training. Train yourself if you can't afford professional training. Audition as much as possible. Use knowledge from auditions to become better. Try out for talent shows. Cultivate yourself as a triple threat. Be wary of schemes.,0
How to Communicate Emotion Through Touch - Expressing Other Emotions with Touch,Gain a person’s attention. Let a person know you’re in charge. Reveal surprise. Disclose fear. Indicate anger.,0
How to Boil Cabbage - Boiling the Cabbage,Bring water to a gentle boil over medium-high heat. Add the cabbage to the boiling water. Cook uncovered at a simmer or gentle boil. Remove the cabbage from the pot. Season the cabbage.,1
How to Answer What Interests You About This Job - Showing Why You Like the Company,Do your research. Pay attention to the culture. Make notes. Incorporate what you know into your answer.,1
How to Teach a Child to Use the Telephone,"Let your child hold the phone without pushing any buttons, while you point to the buttons and explain which button does what, and tell him/her which buttons s/he should NEVER touch. Let your child answer the phone, with a 'script' that you write out for him/her. When your child is comfortable with this, and has whatever you want him/her to say memorized, let your child begin to answer the phone by him/herself. Let your child begin to call his/her friends/relatives. After your child is comfortable with this, and you are comfortable with letting him/her do this, you may let him/her answer/make calls whenever!",1
How to Help when Someone Dies - Performing Practical Tasks,Sit down with the bereaved person and make a to-do list. Co-organize the funeral services. Act as an intermediary with officials. Make meals. Clean and organize the house. Provide childcare. Launch a fundraising drive.,0
How to Find Fulfilling Work - Finding a Possible Career Path,Ask yourself about the legacy you want to leave. Make a list of options. Narrow down the list. Identify barriers preventing you from being who you want to be. Accept the confusion.,1
How to Talk to Someone with Disordered Eating During the Holidays - Avoiding Stereotypes,Stop making assumptions about what disordered eating looks like. Offer support without commenting on their appearance. Show gratitude for their presence around the holidays.,0
How to Connect Jambox to Mac - Turning On Bluetooth on your Mac,"Click the ""Apple"" menu. Click System Preferences. Click the ""Bluetooth"" icon. Click Turn Bluetooth On.",1
How to Study Using Index Cards - Using Notecards with Different Systems of Studying,Decide on an index card format. Take notes over a specific topic. Outline your essay on cards. Take notes over specific sources. Create practice tests. Treat studying as a game.,0
How to Issue a Refund - Using Google Payments Merchant Center,"Sign in to your Google Payments Merchant Center account. Click on the order for which you want to issue a refund. Click on “Refund order” in the right sidebar. Select the reason for the refund from the dropdown menu, then click “Refund order.” Google will immediately process the refund.",1
How to Help Stop Sex Trafficking - Taking Individual Action,Write a letter to your representatives. Volunteer at a local organization dedicated to helping victims. Write a letter to the editor of a local newspaper or magazine. Talk to your friends and family members about it. Offer survivors legal services if you are an attorney. Provide low-cost medical services if you are a healthcare provider. Report stories about sex trafficking if you are a journalist.,0
How to Winterize Your Car - Checking the Mechanics,Change your engine oil. Check your belts and hoses. Replace old coolant with antifreeze. Make sure your 4-wheel drive is working. Check your battery. Check your defrosting and heating units.,0
How to Sleep with a Cough - Hydrating Your Breathing Passages,Drink water during the day to stay hydrated at night. Take a steamy shower or bath to wind down at the end of the day. Enjoy hot tea with honey before bedtime. Turn on a humidifier in your bedroom.,0
How to Tell if You Genuinely Like Someone - Recognizing Signs of a Crush,Determine if you leave a date with them feeling happy. Figure out if you feel excited when they call or text you. Recognize when you see things that remind you of them. Spend time with other people to see if you miss them. Notice if you contact them first when you get good or bad news.,0
How to Make a Guy Want You - Drawing Him In Further,Let him know your feelings. Touch him or graze past him. Meet his friends and get them to like you. Follow up on important events and dates. Spend more time together.,0
How to Help Someone Who is Moving - Helping During the Move,Show up early if you have agreed to help load and physically move the items. Bring coffee and donuts. Help get the moving truck. Assist in organizing the movers. Be ready to fetch whatever your friend or the movers need. Use your strength if you have it.,0
How to Get Stains Out of Carpet - Maintaining Carpets and Preventing Stains,Get your carpet cleaned every year. Place mats in high-risk areas. Vacuum frequently. Keep a dehumidifier running in your house. Clean all prospective stains immediately.,0
How to Deal With Neurotic Twitching - Dealing with Neurotic Twitching,Be patient and don't assume the worst. Don't get frustrated with diagnosing. Don't pay too much attention to it. Consider some form of counseling or therapy. Ask your doctor about medication.,0
How to Fight Burnout at Work - Taking Care of Yourself,Take short mental breaks. Eat right. Get some rest. Work out to relieve stress. Plan some time off. Socialize outside of work.,0
How to Determine if You Can Do a Home Remodel Yourself - Weighing the Cost of the Repair,Ask yourself whether it's worth the time. Consider whether the mess is worth it. Think about whether you'll actually save money. Don't do it just for the resale value.,0
How to Tell the Difference Between Detachment and Indifference,"Consider some common situations where detachment makes sense. Consider the following situations where detachment is critical. Try finding some examples in your own life where detachment paid off in a positive or productive way. Take closer look at indifference and apathy. Consider times when you may have been indifferent. Hopefully this has brought clarity, but now lets consider gray areas. Consider gray area examples where decisions are not always simple.",0
How to Take Up Speedcubing - Preparing with Basic Skills,Start with a basic Rubik's Cube. Keep solving.,1
How to Flirt With a Guy Online - Behaving Online,Write properly. Be civil with your posting. Try to be nice to everyone. Keep your public flirting focused on one person.,0
How to Set Up Guitar Pedals - Using an Effects Loop,Examine your amp. Place your delay and reverb effects in the amp's effects loop. Move volume and modulation into the effects loop.,1
How to Uninstall a Program - Linux,Open the terminal. Display a list of all the installed programs. Uninstall a program. Review what will be uninstalled. Old package installers are taking up too much space.,0
How to Train Great Danes - Undertaking Dog Training Basics,Start early. Never beat your dog. Reward your Great Dane for proper behavior. Express dissatisfaction firmly and calmly. Be patient. Socialize your dog early.,0
How to Care for a Chilean Rose Tarantula - Feeding Your New Tarantula,Let your pet adjust. Offer your tarantula crickets. Dust the crickets with vitamins.,0
How to Buy a Remote Starter for a Truck,Determine what kind of remote starter you need for your particular type of truck. Make a list of the features you want. Search the Internet for reputable remote starter system manufacturers. Contact manufacturers and ask them to send you all of their remote starter product brochures. Read over the brochures and decide which systems have all of the features you need and want. Research the remote starter systems that apply to your specific needs online. Find retailers that sell the remote starter you are interested in and shop around for the best price.,1
How to Read While Walking - Formulating Your Plan,Choose a general location that suits your needs and preferences. Avoid unsafe locations. Take a dry run. Know your route like the back of your hand. Decide on an interesting and appropriate book. Plan to not take notes. Pick a good time and day. Install a reading rack on your home treadmill if you plan to use it.,0
How to Make Your Computer Run Faster - Macintosh,"Check your hard disk space. Use your Activity Monitor to find out which applications are using the most CPU. Uninstall unnecessary programs. Delete, compress or remove large and unnecessary files. Prevent unnecessary programs from starting when the Mac boots. Repair disk permissions. Remove unused languages. Add more RAM to your computer.",0
How to Change Your General Preferences on Safari - iOS,"Tap the Settings app on your device. Scroll down and tap ""Safari."" Tap ""Search Engine"" to change your default search engine. Tap ""Passwords"" to view your stored passwords. Use the ""AutoFill"" menu to set your AutoFill settings. Switch your Favorites folder with the ""Favorites"" option. Choose how links are opened with ""Open Links."" Turn on the pop-up blocker to prevent pop-ups. Enable ""Do Not Track"" to help prevent websites from tracking your browsing. Tap ""Clear History and Website Data"" to delete your browsing data.",1
How to Use Bing Maps - Viewing Maps,Visit Bing Maps. Identify a location. View the map.,1
How to Wear Enamel Pins - Putting Them on a Jacket,Attach a few enamel pins to your collar for an eye-catching accent. Wear a bunch on the front of your denim jacket to add design. Spice up your cuffs by attaching pins to them. Be bold by adding pins to the lapels of your leather jacket.,0
How to Make Your Boyfriend Miss You - Increasing His Feelings of Attraction,Look your best. Show off your great personality. Make eye contact. Wear red. Choose a signature scent. Maintain a social life outside of your relationship.,0
How to Collect Rainwater for Drinking - Filtering the Rainwater,Use the rain barrel’s faucet to drain the water into a container. Run the water through an activated carbon filter to remove particulate. Boil the water for 1 minute to kill any germs or bacteria in the water. Disinfect the water with chlorine bleach if you’re unable to boil it. Test the rainwater every 1–2 months for pollutants and bacteria.,1
How to Apply for a Utility Patent - Evaluating Your Invention's Patentability,Meet the basic requirements for patentability. Determine your invention's classification. Conduct a prior art search. Decide whether you need international protection.,1
How to Make Caramel Frosting - Making Classic Caramel Frosting,"Place a 2-quart sized saucepan over medium heat. Add the brown sugar into the pan and stir. Let the mixture boil for 2 minutes, then pour and stir in the milk. Set the saucepan on the side until it's cooled down. Pour, a little at a time, the powdered sugar; stir as your pour. Fill a bowl with cold water. Finished.",1
How to Cover Dining Room Chairs - Covering Chairs with Store-Bought Slipcovers,Decide what parts of your chair you want to cover. Determine what shape and size slipcovers will fit your chair. Decide which type of fabric you want. Fasten the slipcover onto your chair.,1
How to Store Collard Greens - Storing Fresh Collard Greens,Do not wash the collard greens. Place the collard greens in an air-tight plastic bag. Refrigerate the collard greens. Wash before preparing.,1
How to Install an SSD in Your Laptop - Installing the SSD,Open Start . Click . Click Shut Down. Disconnect all cords connected to your laptop. Put on EDS wrist straps. Remove the battery. Remove access panel. Remove old hard drive. Place SSD in the hard drive slot. Put the battery and access panel back on. Boot up your laptop.,1
How to Blow Dry Curly Hair with a Diffuser - Blowing It Dry,Flip your hair upside down. Turn on the diffuser and hold it pointed up. Lay a handful of curls in the bowl of the diffuser. Lift the diffuser until it touches your head to dry your roots. Move on to the next section of hair. Continue until your hair is mostly dry.,1
How to Take Legal Action As a Victim of Violence at a Bar - Suing Your Assailant,Identify the perpetrator. Choose your court. Draft your complaint. File your complaint. Have the defendant served. Wait for a response.,1
"How to Learn English Grammar - Studying Grammar on the ""Sentence"" Level",Learn how to structure a basic sentence. Maintain correct subject/verb agreement. Form compound sentences. Practice using conditional phrases. Understand how to use clauses. Manage punctuation.,0
How to Clean Under Laptop Keyboard Keys - Putty,"Buy special cleaning putty. Place putty on the keyboard. The putty will form its shape over the keys and seep through the cracks. Pull the putty carefully off the keyboard, so as to not break off the keys. Repeat all over the keyboard for a thorough clean.",1
How to Have Jehovah's Witnesses Go Away - Interacting with a Jehovah's Witness,Answer the door. Interrupt them. Be honest. Politely decline. Close the door.,1
How to Make an Ender Chest in Minecraft,Obtain eight obsidian blocks. Obtain an ender pearl. Obtain a blaze rod. Build a crafting table. Craft blaze powder. Craft an Eye of Ender. Craft the Ender Chest.,1
How to Dye Crocs Shoes - Filling the Bin with Your Paints,Go outside and fill a plastic bin with water. Apply spray paint to the surface of the water. Spray additional colors in the middle of the water if you want multiple colors.,1
How to Pull Your Foreskin Back Without Pain - Managing a Tight Foreskin,Pull back your foreskin slowly and gently. Retract your foreskin during a shower or bath. Pull a tight foreskin back incrementally over days or weeks. Try more intensive foreskin-stretching exercises if needed. Consult your doctor for guidance on a painfully-tight foreskin.,0
How to Choose a Designated Driver - Creating a Backup Plan,Call a taxi. Use public transportation. Make use of designated driver programs. Have a designated friend or family member on speed dial.,0
How to Alleviate Headaches During Pregnancy - Recognizing More Serious Problems,Look for symptoms of high blood pressure. Recognize the signs of pre-eclampsia. See a doctor if symptoms persist or get worse.,1
How to Identify a Seasonal Allergy Reaction in Young Children - Identifying Patterns,Differentiate allergies from a cold. Pay attention to the timing of symptoms. Consider family history.,0
How to Fix Stuck Bicycle Brakes - Using Advanced Fixes,Bleed and replace the brake fluid. Consult your user's manual for more specific instructions. Adjust the calipers for rim brakes. Take your bike to a mechanic.,0
How to Buy a Tuxedo - Choosing a Style,"Pick a jacket that suits your style. Select a color, fabric and trim. Choose a lapel facing. Decide on a style of accessories. Pick out a tuxedo shirt.",0
How to Help Stop Police Brutality - Taking Political Action,Take part in protests and sign petitions. Call your elected officials. Elect public officials who support police reform. Run for a local public office to try and fix the problem yourself.,0
How to Get over the Flu Quickly - Trying Natural Remedies,Eat more foods that are rich in vitamin C or take a supplement. Drink 15 mL (0.51  fl oz) of elderberry syrup daily. Try taking a zinc lozenge at the first signs of the flu. Take a daily vitamin D supplement to help prevent the flu. Drink a cup of Echinacea tea at the first signs of the flu.,0
How to Start an Online Business As a Kid - Brainstorming,"Make a list of things you like to do and are good at. Consider how you can make your product unique, high quality, and something people might want or need. Write down your ideas. Name your business/brand and products. Do some market research. Determine shipping costs. Send out your orders as fast as you can. Take advantage of postal discounts. Think about where on the Internet you will sell your product or service. Plan on how you will accept payment.",0
