goal,steps,ordered?
How to Stop a Mole from Bleeding - Seeing a Doctor for a Bleeding Mole,Visit your doctor if a mole starts bleeding without provocation. Describe the mole and related symptoms to your doctor. Ask your doctor if they recommend surgery to test the mole. Never attempt to remove your own mole at home.,0
How to Hitchhike - Being Prepared,"Invest in a good map. Know how to find a good hitchhiking spot. Pack as light as possible, but bring enough supplies to last you a few days. Consider making a sign. Be aware of the laws. Make digital copies of all your IDs, documents, and papers. Be prepared financially. Be mindful of the weather.",1
How to Increase Creativity - Increasing Creativity on Specific Projects,Experiment freely. Don't judge ideas while brainstorming. Mix and match old ideas. Change your environment when you feel confined or stressed. Work with others on projects. Try freewriting or drawing. Take time to work on other projects.,0
How to Create a Media Kit - Planning Your Media Kit,Determine the format. Look at other media kits for inspiration. Write a brief introduction. Create a mission statement. Write an FAQ. Collect published articles and publications. Collect product or service reviews. Gather press releases. Collect audience stats and site metrics. Include corporate identity samples.,0
How to Control Notifications on Periscope - Configuring Periscope’s Notifications Settings on iOS,Tap the Settings app on your iPhone. Go to Notifications. Allow notifications for Periscope.,0
How to Rephrase - Putting Content in Your Own Words,Read the content carefully. Do not use words from the original text. Put the content in your own words. Build off the existing content. Cite the source when you're done.,1
How to Eat Free - Getting Free Commercial Foods,"Try to find weight loss programs that offer free samples on the internet. Go to the mall. Get free food from supermarkets or stores. Win offers online, avoid time consuming scams by either keeping an eye out for local contests or the ones held by major brand names.",1
How to Make a Beanbag Tripod,"Decide on the size and style you want your tripod to be. Create some templates of the appropriate size for what you are making. Take an 8 x 5.5 inch (20cm x 14cm) piece and attach it to a 4 x 5.5 inches (10cm x 14cm). Create or visualize about a 1/2 inch (1.27cm) seam line and sew there. Double sew the seams to make sure that they hold. Continue matching the lengths. Do this until all of the seams, except for one short one, are closed. Invert the bag that you have just created. Cut the corner of the bag if the beans are still bagged. Determine whether the bag will work as a tripod. Sew the beanbag tripod together so that the beans won't fall out.",1
How to Give Advice - Acting Right,Don't judge them. Remove your bias. Be honest. Express confidence in them. Know when it's appropriate and when it's inappropriate to stage an intervention.,1
How to Care for Doberman Pincshers - Training Your Dog,Use a positive-reinforcement training method. Train your dog to respond to basic commands. Train your Doberman on a regular basis.,0
How to Cope With Hurtful Insults - Deflecting the Insult,Resist returning an insult. Conceal your pain from the insulter. Avoid internalizing the insult. Avoid reacting without thinking first.,1
How to Identify a Pug - Recognizing Body Structure,"Pay attention to the dog's size. Look at the tail of the dog. Notice the dog's head shape. See if the dog has dark, prominent eyes. Look for small ears that rest atop the dog's head. See if the dog's build fits the motto multum in parvo (""a lot in a little"").",1
How to Get Away from the Computer - Identifying the Sources,Know the risks. List what you do on the computer. Figure out how much time you spend in front of the screen.,0
How to Relieve Gas - Treating Chronic Gas,Consider your symptoms. See your doctor.,0
How to Do the 'Pass It On' Trick in Class - Flash mobs,"Whisper to the person closest to you ""At [insert time here] [insert what you want to do here]. At the suggested time, the class will do the suggested thing. Understand the risk.",1
How to Use Google Keyword Planner - Using the New Keyword Search,"Click on ""search for new keyword and ad group ideas."" Enter the necessary data for your product. Avoid the ""landing page"" service. Choose your targets. Customize your search. Click on ""Get Ideas.""",1
How to Conclude a Paragraph - Reviewing Your Paragraph,Reread what you’ve written. Focus on the main idea. Summarize your ideas.,0
How to Pick out Your Perfect Cell Phone,"Get on your networks website or go into a local provider. Pick a phone that fits your budget. By now it should be narrowed down to 2-5 phones. Now you should have 2-3 phones. Look at this phone long and hard and think ""Am I going to want this phone in a year?"" Enjoy your new phone!",1
How to Rotate Pages in a PDF Document Using Adobe Acrobat - Steps,Open the Rotate Pages dialog box. Set direction of rotation. Specify page range. Specify page numbers. Click OK.The selected pages are rotated in the specified direction.,1
How to Make an Outdoor Canopy - Making a Canopy with 4 Poles and a Tarp,"Buy a high-quality tarp with grommets, big enough to cover the desired area. Clear the area for the canopy and lay out the tarp on the ground. Attach a tent pole to each corner of the tarp with nylon rope. Lift up the tarp with the help of 4 people and stick the poles into the ground. Stretch out the ropes from each corner and secure them with tent stakes. Put 1 longer tent pole in the middle of the canopy and stick it in the ground.",1
How to Get Rid of Bed Bugs Naturally - Cleaning Everything and Containing the Infestation,"De-clutter the room. Wash all bedding and clothing at high temperatures, and store them in plastic bags or bins to prevent re-infestation. Place everything you washed into plastic bins with tight fitting lids the instant you take them out of the dryer. Vacuum everything several times a week. Dispose of the vacuum cleaner bag properly. Consider using a steam cleaner. Don't keep items that you can't salvage.",1
How to Cut Wood Slices - Cutting Large Slices with a Chainsaw,"Wear thick gloves, long sleeves, and protective goggles. Prop the end of the tree up at least 6 inches (15 cm) off the ground. Take note of the knots in the trunk so you can avoid them. Measure and mark the tree where you want to make the cut. Hold the chainsaw firmly with both hands and turn it on. Glide the chainsaw blade through the wood slowly. Move the slice out of the way and repeat, if desired.",0
How to Style Waist Length Hair - Getting Creative with Chopsticks and Braids,Put the top half of your hair in a ponytail. Twist your ponytail into a bun. Hold your bun in place with chopsticks. Decorate with a second chopstick. Separate the rest of your hair into quarters. Braid each quarter.,1
How to Learn Cooking by Yourself - Mastering the Basics,Review safe cooking guidelines. Follow recipes exactly. Start with breakfast. Move on to making simple meals more decadent. Try your hand at soups and stews. Move on to casseroles.,0
How to Cook Goose Breasts - Pan-Roasted Goose Breasts,Salt the goose breasts and bring them to room temperature. Preheat the oven to 375 °F (191 °C) and cut slashes across the skin. Heat olive oil in a skillet over medium-high heat. Sear the goose breasts for 8 minutes. Put the skillet in the oven and roast the breasts for 15 minutes. Serve the pan-roasted goose breasts.,0
How to Fix a Bicep Tear - Resuming Physical Activity,Resume activities slowly and only after the pain subsides. Begin with pendulum exercises. Perform shoulder shrugs and shoulder blade pinches. Do flexion stretches by bending your elbow 10 times. Do 10 supination and pronation stretches. Do 10 internal and external rotations. Try full shoulder flexion stretches. Use resistance bands after at least a week of pain-free stretching. Do 2 sets of 8 to 12 biceps curls.,1
How to Complete an Instacart Delivery - Proceeding,Fill out the Instacart Shopper survey - which has three pages. Review your Shopper data.,0
How to Get Your Crush to Notice You (for Girls) - Looking Your Best So Your Crush Will Notice You,Groom carefully. Dress carefully. Keep your teeth clean.,0
How to Have a Relaxing Self Pampering Night - Taking a Bath,Gather up the things you need. Run a warm bath. Add something fun or soothing to your bath water. Turn on some music. Turn down the lights and light some candles. Put on a soothing face mask. Try playing in the bath. Lie back and relax. Moisturize your skin when you're done. Get into some comfy clothes.,1
How to Choose Comfortable Golf Shoes,"Look for a pair that is lightweight and flexible, but also sturdy. Find golf shoes with built-in memory foam - these can be especially comfortable. Make sure that you get a pair of shoes that are waterproof and include moisture-wicking material on their exterior. Walk around in the shoes and make sure that they feel absolutely comfortable for you! When purchasing your shoes from a golf store, see if they have a little putting green and try out the different positions you would normally stand in when hitting your shot - this will let you feel how the shoes will conform to your foot at various angles and pressure. If you are the type that likes to look good, be sure that the style fits your personality and your wardrobe - did you know that some athletes actual perform poorly when they do not feel the look their best? Can't find a pair of shoes that are comfortable out of the box? Take advantage of any maintenance / additional warranties that a golf store may have to go with your shoes.",0
How to Buy a New Car Through Fleet Sales - Figuring Out Your Automotive Needs,Identify your specifications. Decide your budget. Research new cars online. Understand the fleet sales pricing process. Check the sale price of the car you want.,0
How to Bake a Cake - Making Apple Cake,"Gather your ingredients. Grease and flour the cake pan, then preheat the oven to 350 °F (177 °C). Melt the butter and allow it to cool. Stir the dry ingredients in a small bowl. Prepare the apples. Blend the wet ingredients. Add the dry mixture to the wet mixture. Fold in the apples. Pour the batter into the pan. Bake the cake for about 50 minutes.",1
How to Dye Your Pet - Caring for Your Dyed Pet,Avoid letting your pet lick the dye. Watch for an allergic reaction. Acknowledge color fading. Observe behavioral changes in your pet.,1
How to Win Draw My Thing on Mineplex - Drawing,Be prepared. Start drawing as soon as you can. Don't rush too much. Make your drawings as simple as you can. Use appropriate colours.,1
How to Think Logically - Exercising Your Mind,Test your recall. Do crossword puzzles. Learn a new talent. Socialize. Change up your routine.,0
How to Stop Hormone Replacement Therapy (HRT) - Stopping Hormones,Continue taking hormones for as long as your doctor instructs you to. Take lower doses of hormones. Use hormones less often if directed to do so by your doctor. Continue to be monitored by your doctor.,0
How to Etch Wood - Etching the Wood,Use a wood chisel if you want to carve straight lines. Use a wood gouge if you want to carve straight or curved lines. Use dremels if you want to lightly etch a design onto the surface. Use wood burning tools to create dark lines.,1
How to Help Rhinos - Donating and Raising Money,Research rhino conservation organizations online. Donate money to rhino conservations. Sign up for monthly donations if you can afford it. Adopt a rhino from a rhino conservation organization. Throw a fundraiser to raise donations and awareness.,0
How to Handle the Legal Aspects of a Home‐Based Business - Getting Required Licenses and Permits,Get a home occupation permit. Apply for a general business license. Get sales tax permits. Register your business name. Get occupational licenses or permits.,1
How to Get Curly Hair Without a Curling Iron - Curling Your Hair With Fabric,Find an old shirt. Cut fabric into 1” wide sections that are a few inches long. Clean your hair. Detangle your hair. Apply mousse to your hair. Select the type of curl. Split your hair into sections. Wrap one section of your hair around one piece of the fabric you cut in the last step. Tie the ends of the fabric into a knot. Go to sleep. Untie all the fabric knots when you wake up. Separate each coil with your fingers.,0
How to Believe in Yourself - Furthering Good Habits,Connect with people. Build you up. Find ways to keep moving forward. Be proactive. Focus on the positive. Do things that are hard. Practice speaking up for yourself. Help others.,0
How to Download Kindle Books on an iPad - Adding Non-Kindle Content to Your Kindle App,Know what can be transferred. Download and install the transfer software for your computer. Send compatible documents to your Kindle app.,0
How to Deal With Internalized Homophobia - Identifying Internalized Homophobia,Be willing to work on your problems. Ask yourself questions. Consider the impact of internalized homophobia.,0
How to Write Sad Stories - Prewriting Your Story,Free write about sadness. Seek inspiration. Learn how to begin a story. Outline your story.,1
How to Memorize Numbers - Using the Major System,Learn the rules. Study which consonants commonly correspond to which numbers. Notice that similar sounds are grouped together. Practice by taking some words and determining which numbers go with them. Take some phone numbers and make words and phrases out of them. Break up large numbers into word phrases.,1
"How to Pray - When, Where & Why","Take the time to pray. Find a good spot to pray. Know your purpose. Understand that prayer does not have to involve crafted, reflective silence.",1
How to Shoot Low Light - Adjusting Your Settings,Shoot in RAW format to help make images brighter when you’re editing. Try the HDR camera mode if you’re shooting from your phone. Set the lowest f-stop setting to increase the aperture size. Use shutter speed matching the lens size to prevent blurry photos. Adjust the white balance settings to get natural-looking colors. Increase your ISO setting to get more exposure.,0
How to Play French Darts,Gather materials. Set up the game. Pick teams. Learn the basics. Keep score. Continue the rounds of play. Keep playing until you have a winner.,0
How to Get Your Ferret Vaccinated - Understanding Your Ferret's Vaccination Needs,Ask for your ferret’s vaccination record when you adopt it. Find a veterinarian that has experience with ferrets. Vaccinate for rabies and canine distemper. Maintain good vaccination records.,1
How to Turn On Windows Defender - Turning on Windows Defender,"Make sure you recently turned off Windows Defender. Open Start . Open Settings . Click  Update & Security. Click the Windows Security tab. Click Virus & threat protection. Click Virus & threat protection settings. Click the ""Off""  switch below the ""Real-time protection"" heading. Click Yes when prompted.",0
How to Manage Aggression in Older Dogs - Creating a Less Stressful Environment for Your Dog,Make sure your dog has a safe space. Prepare your dog before a new family member enters the home. Isolate your dog if the environment becomes stressful.,0
How to Prepare to Photograph Your First Wedding - Scout the Locations,Scout locations. Google the locations before you go on your recce and see what other photographers have done there in the past.,1
How to Teach Employability Skills - Teaching Work Ethic,Encourage students to look at the outcome of a task. Assign small groups of students to create a structure for an egg. Use the rubber band-cup challenge to teach them to complete a task together. Encourage apprenticeships and internships. Invite business leaders to come speak to your students.,0
How to Choose Kayak Paddles - Picking a Paddle Length,Measure the kayak’s width. Measure your torso size. Choose a shorter paddle if the kayak’s seat is higher up. Test the paddle by holding your arm up to it.,0
How to Wake up Your Hamster Without Scaring It - Waking Your Hamster Gently,Talk to him softly. Offer him a treat. Blow in his face. Avoid poking him. Move slowly.,1
How to Journal for Therapy - Getting Introspective,"Journal what you feel. Evaluate your actions, your thoughts, and your emotions. Journal in conjunction with your therapy sessions. Don't be afraid to get creative. Go into detail. Give yourself writing prompts to stimulate your self-inspection. Think of your journal like a friend. Read through your journal regularly.",0
How to Measure an Angle Using a Protractor - Calculating Reflex Angles,Draw a straight line from the vertex of the angle. Place your protractor on the straight line to measure the acute angle. Add the measurement of the acute angle and 180.,0
How to Roll Paper Cartridges (Reenacting) - Twisting the Left Edge,"Leave the dowel in the paper, with the guide line along the right edge of the paper. Twist the excess paper on the left edge tightly. Fold the twisted edge onto itself. Remove the dowel.",1
How to Cook Diced Beef - Sautéing Diced Beef,"Remove the fat from your meat. Slice the meat into diced cubes. Mix your diced beef with flour, salt, and pepper in a medium-sized mixing bowl. Heat oil on the skillet and cook your beef in batches. Check to see that your meat is properly cooked. Create your seasoning. Warm your diced beef. Pair your beef with your favorite sides.",1
How to Make Your Ex Boyfriend Want You Back - Making Him Notice You Again,Let your ex see you having a great time without him. Make him jealous (optional). Make him jealous on social media. Start hanging out with him a bit. Let him see how you've changed. Read the signs. Slowly start to date again.,0
How to Treat Genital Herpes - Recognizing Genital Herpes,Assess your herpes risk. Look for herpes symptoms. Seek a medical diagnosis if you experience symptoms.,1
How to Boil Cabbage - Preparing the Cabbage,Peel off the outer leaves from the cabbage head. Rinse the entire head of cabbage. Cut your cabbage. Shred or chop your cabbage into the desired shape.,1
How to Sew on a Wig - Preparing Your Hair and the Wig,Choose a lace wig. Braid your hair. Try on the wig. Place clips to hold the wig while you sew. Cut the lace as needed to match your natural hairline. Thread a hair weaving needle with 18” (46 cm) weave thread.,1
How to Make Straight Cuts with a Circular Saw - Constructing and Using a Straight Edge,Cut ⁄4 in (0.64 cm)-thick plywood to form the straight edge’s base. Saw ⁄4 in (1.9 cm)-thick plywood for the straight edge’s fence. Align the boards and fasten them together with glue and nails. Clamp the straight edge and trim it with a circular saw. Raise and measure the board you wish to cut with the straight edge. Line up the straight edge base with the marks and clamp it in place. Cut the board with a circular saw.,1
How to File Probate in Florida - Transferring Assets through Summary Administration,Confirm that you qualify. Have the property appraised and calculate the entire estate. Secure the form. Perform a diligent credit check. Fill out the form. Get the surviving spouse’s signature. Have other beneficiaries sign. Draft a plan for distributing assets. File the petition in circuit court. Serve copies on other beneficiaries. Bring an action to determine homestead.,1
How to Get Better Friends - Being a Good Friend,Listen to your friends when they have something they want to tell you. Show genuine appreciation for your friends to let them know you care. Make time to see and communicate with your friends. Respect your friends' boundaries so you don't come across as clingy.,0
How to Get Employees to Mingle at a Christmas Party - Helping People Mingle,Help people bond with a fun activity. Help people who don't know each other find common ground. Have employees fill out a fun questionnaire in advance. Have an advance rule that no one can discuss business matters at the party. Don't let anyone get too drunk.,0
How to Dance to Country Music - Mastering the Basics,Listen to a variety of country music to familiarize yourself with the beats. Watch videos of people dancing to country music. Master the two-step for a foundation for your dance moves. Practice the “sweetheart” position to set yourself up to do spins. Practice doing basic dips with your partner.,0
How to Make a Best Friend - Going from Friends to Best Friends,Start hanging out with this friend. Nurture the new friendship. Make sure it goes both ways. Get to know their friends.,0
How to Become a Certified Life Coach - Training to be a Life Coach,Use online training modules. Find distance learning courses. Participate in local workshops. Meet one-on-one with a mentor.,1
How to Make a Camo Cake - Baking the Cake,"Preheat the oven according to the temperature on the boxed mix. Grease the cake pans and line them with parchment paper. Prepare the boxed cake mix following the instructions on the back. Divide the cake batter evenly between 4 bowls. Stir green, brown, and black gel food coloring into the divided batter. Alternate spooning different colors of batter into lightly greased pans. Bake the cakes in a pre-heated oven according to package directions. Allow the cakes to cool before removing them from the pans.",0
How to Prune Citrus Trees - Tailoring Your Pruning,"Aim to remove 20% of the total canopy. Focus on the long, gangly branches. Remove any low-lying “skirting” branches. Cut out any swollen stems. Cut out any dead or diseased wood. Cut out any wood laying on top of one another. Trim back watershoots in young trees.",1
How to Find Surface Area of a Triangular Prism - Finding the Lateral Area,Write down the formula for finding the lateral area of a triangular prism. Calculate the perimeter of one base. Plug the perimeter into the lateral area formula. Plug the height of the prism into the lateral area formula. Multiply the perimeter of one base with the height of the prism.,1
How to Make a Chocolate Bar - Tempering and Molding Chocolate Bars,"Choose an unwaxed chocolate designed for melting. Cut the chocolate into small pieces around ⁄2 inch (1.3 cm) in size. Bring a pot of water to a simmer. Keep 1/4 of your chocolate chilled for “seeding”. Place the bowl of chocolate over your pot of water. Check the temperature of the chocolate as it melts. Remove the bowl from the heat to seed your chocolate. Put the chocolate back over the pot to raise its temperature. Pour the chocolate into a silicon mold or rimmed baking tray. Refrigerate the chocolate until it is set. Store the bars in a cool, dry place for up to a month.",0
How to Blow Dry Layered Hair - Blow Drying Short Layers,"If your hair is several inches above your shoulders (your shortest pieces less than an inch long), section off the hair right above your ears and clip it away. Blow dry your shortest layers (below the ears) with just the blow dryer in a downwards motion, combing through the hair with either your fingers or a brush. Proceed to dry the rest of your hair the way described previously.",1
How to Choose Kids Books for Harry Potter Fans - Going With Your Child or a Friend,"See if any fantasy book clubs are open for members. Read a rival book series, and then choose your favorite book/let your child choose their favorite book from the rival series and Harry Potter. Be on the lookout for books by J. K. Rowling.",0
How to Brown a Roast for Cooking in a Crockpot,"Rinse the roast with cold water. Place the meat on a cutting board. Pat it dry with paper towels, pressing to absorb as much water as possible. Trim any excess fat off the meat. Cut the roast into smaller pieces if it is too large to fit into your crockpot. Heat 2 tablespoons (30 mm) of cooking oil in a large Dutch oven on medium high heat. Sprinkle and rub salt and pepper all over the meat. Brown the meat in the hot oil for several minutes on each side. Remove the seared meat and place it in the crockpot you’ll use to roast it.",1
How to Apply for a Marriage License in Kentucky - Getting a Marriage License in Kentucky if Both Parties are over 18,Visit the county clerk’s office to apply for a marriage license. Present your identification. Complete the marriage license application. Pay the fee for the marriage license. Complete the marriage ceremony within 30 days of receiving your license.,1
How to Act Around Your Ex - Seeing Your Ex at Work or School,Behave professionally at all times. Communicate issues discreetly. Find a buffer.,0
How to Hide Friends on Facebook - On Mobile,Open Facebook. Tap ☰. Scroll down and tap Settings. Tap Account Settings. Tap Privacy. Tap Who can see your friends list?. Tap Only me.,0
How to Do Math Calculations in Spotlight for Mac - Advanced calculations,Do advanced calculations following the order of operations. Press the ⏎ Return key to open the full calculator (your Mac's built-in calculator).,0
How to Retire Young - The Basics: Making Smart Decisions,"Determine exactly what a young age is. Learn to manage finances. Get a college education. Save early, save often. Reduce your expenses.",1
How to Change Your Password in Linux Using Terminal,"Open the Terminal if using a desktop environment. Type passwd in the terminal. If you have the right permissions, it will ask you for your old password. After entering your old password, enter in the new desired password.",1
How to Report Visa Violations - Reporting a Visa Holder,Gather information. Find a hotline or local office of ICE. Submit your tip to ICE.,0
How to Be More Perceptive - Trusting Your Intuition,Understand intuition and its role in your life. Discover traits of the intuitive person. Recognize some of the signs. Learn to become more intuitive. Check your gut decisions against the facts.,1
