goal,steps,ordered?
How to Customize Your Yahoo! Tool Bar,"{""smallUrl"":""https:\/\/www.wikihow.com\/images\/5\/58\/Settings-button-1.jpg"",""bigUrl"":""https:\/\/www.wikihow.com\/images\/5\/58\/Settings-button-1.jpg"",""smallWidth"":460,""smallHeight"":394,""bigWidth"":760,""bigHeight"":651.4285714285714,""licensing"":""<div class=\""mw-parser-output\""><p>License: <a rel=\""nofollow\"" class=\""external text\"" href=\""https:\/\/creativecommons.org\/licenses\/by-nc-sa\/3.0\/\"">Creative Commons<\/a><br>\n<\/p><p><br \/>\n<\/p><\/div>""} Click on the Settings button located at the right end of the toolbar to get a pull-down menu. Click on the option ""Toolbar Preferences"" to  change the look of the toolbar. {""smallUrl"":""https:\/\/www.wikihow.com\/images\/4\/4b\/Tb-settings.JPG"",""bigUrl"":""https:\/\/www.wikihow.com\/images\/4\/4b\/Tb-settings.JPG"",""smallWidth"":460,""smallHeight"":399,""bigWidth"":760,""bigHeight"":658.6666666666666,""licensing"":""<div class=\""mw-parser-output\""><p>License: <a rel=\""nofollow\"" class=\""external text\"" href=\""https:\/\/creativecommons.org\/licenses\/by-nc-sa\/3.0\/\"">Creative Commons<\/a><br>\n<\/p><p><br \/>\n<\/p><\/div>""}   Click on the Edit Your Apps option to manage the applications. Click the ""Add Apps"" tab  (on the top) and you will see a screen looking like this (see image). {""smallUrl"":""https:\/\/www.wikihow.com\/images\/e\/e0\/Amazon-button.JPG"",""bigUrl"":""https:\/\/www.wikihow.com\/images\/e\/e0\/Amazon-button.JPG"",""smallWidth"":460,""smallHeight"":235,""bigWidth"":760,""bigHeight"":388.52017937219733,""licensing"":""<div class=\""mw-parser-output\""><p>License: <a rel=\""nofollow\"" class=\""external text\"" href=\""https:\/\/creativecommons.org\/licenses\/by-nc-sa\/3.0\/\"">Creative Commons<\/a><br>\n<\/p><p><br \/>\n<\/p><\/div>""}   Remove Amazon from your toolbar. Apply the technique in steps 6 and 7 to every application you would like to add to or delete from your Yahoo toolbar. Click the ""I'm done' button at the bottom of the screen to save your application settings. Look at your complete customized Yahoo toolbar.",0
How to Download Google Docs - On Desktop,Open Google Docs. Select a document. Click File. Select Download as. Click a format.,1
How to Build Back Muscle - Working Your Back with Free Weights,Do arm rows to build both sides of your back separately. Perform 10-12 reps in each set of arm rows. Try a barbell bent over row to bulk up your lower back.,1
How to Stop Being Self Centered - Taking Little Steps,Play a game that you'll be sure to lose. Thank someone for something small. Make eye contact when someone is talking. Listen when people are talking. Read a novel.,1
How to Prepare a Boat for Fishing - Preparing For First-Time Use,License your boat. Purchase all necessary safety equipment. Get an anchor and supporting equipment. Carry items to cope with weather conditions. Consider other items to help you organize your gear.,0
How to Water Orchids - Deciding When to Water,Water sparingly. Consider your climate. See if the potting mix looks dry. Lift the pot to check its weight. Do a finger test.,0
How to Stay Disciplined when Working Remotely - Focusing on your Purpose,Understand your goals. Take pride in your work. Address conflicts directly. Understand differences in roles.,0
How to Use Instacart on an iPhone or iPad,"Open Instacart on your iPhone or iPad and log in to the app if you haven't done so already. Explore the ""Home"" tab. Find the ""Cart""  icon at the top right corner of every tab's page. Learn a little about the ""Search"" tab. Use the ""Browse"" tab to find seasonal items and other features that might catch your eye. Watch out for Instacart-only coupons in the Coupons tab. Use the ""Your Items"" tab to personalize your browsing. Learn about the product pages. Use the buttons below the product page to add items to your Cart.",0
How to Have Good Sleep Hygiene - Creating an Optimal Sleeping Environment,Use your bed for sleeping. Make sure that your bed and pillows are comfortable. Eliminate distractions. Use a “white noise” sound machine. Block out light. Keep your room at the right temperature.,1
How to Refinance Your Mortgage - Starting the New-Loan Process,"Factor in certain eligibility requirements. Know what type of loan you want. Ask about ""no-cost"" refinancing. Shop around. Allow ample time for you to get the hang of all the mortgage terms if you're a newbie on this industry.",1
How to Write a Good Cover Letter for a Developer Job - Getting Your Ideas Together,Learn the most important skills for a development job. Write down your past development experiences. Jot down your general skills. Think about why the job matters to you.,0
How to Stop Alcohol Cravings - Coping with Cravings,Learn what your triggers are and try to avoid them. Think about the past and focus on the future. Seek support from someone you trust. Contact a local branch of Alcoholics Anonymous. Try changing your routine. Be patient and stay focused.,1
How to Scream Sing without Damaging Your Voice - Getting Down the Basics,"Breathe from your diaphragm, not your chest. Layer your screams over the notes you sing. Identify the vocal placement for high and low screams. Scream sing using vocal fry.",0
How to Root Out Thistles - Properly identifying  the species of thistle you're dealing with,Know what makes a plant a thistle. Lean how to identify the Carduus group. Know that the Onopordum group also known as Cotton thistles grow into giants quickly! Recognize  Cirsium species  from the other species by the flower cluster being loosely clustered and this give flowers the look of a cluster of fireworks. Realize that there a lot of other weed plants related to thistles that are omitted from this article.,0
How to Make Out with Your Boyfriend and Have Him Love It - Initiating a Steamy Makeout Session,"Find a comfortable, safe, suitable place. Soften your lips. Flirt. Pull him closer to you. Tease him.",1
How to Start a Snowblower - Inspecting Your Snowblower,Check the oil level. Fuel up. Set the drive control to neutral.,0
How to File a Complaint Against an Arizona Real Estate Agent - Complaining to the Arizona Department of Real Estate,Determine that you have a complaint within ADRE jurisdiction. Prepare a complaint. Write a narrative statement of your complaint. Provide copies of all related documents. Submit your complaint package. Await a response to your complaint.,0
How to Use TSA PreCheck - Knowing What to Do at the Airport,Enter the security line marked for TSA PreCheck passengers. Keep your light jacket and belt on. Keep your shoes on. Refrain from removing items from your luggage. Cooperate with any additional requirements.,0
How to Remove Wrinkles from Leather Jackets - Steaming the Jacket,Place the jacket on a hanger. Turn on your shower. Hang the coat and shower. Wear the jacket.,1
How to Talk to Your Partner About Rekindling a Romance - Random delights,Give your partner romantic gifts at unexpected times. Do something special for your partner. Express your emotional affection to your partner in writing.,0
How to Make Perler Bead Snowflakes - Using Your Snowflakes for Decorations,"Make your snowflake into a magnet. Add string to the snowflakes. Decorate planners, notebooks, or binders with your snowflakes.",0
How to Extinguish a Candle - Blowing out the Candle,Position your face close to the flame. Purse your lips together and blow. Stand clear of the smoke.,0
How to Get Rid of Cellulite on Thighs - Developing Healthy Habits,Try cellulite-fighting lotions and creams. Get a lymphatic massage. Make sure your hormone levels are normal. Relax.,0
How to Throw Away a Trash Can - Recycling Your Trash Can,Find your local recycling center. Take your metal trash can to a scrap metal recycling facility. Donate your trash can.,1
How to Become an HR Professional - Expanding Your Skillset with Internships and Volunteering,Seek out human resource internships. Volunteer your time. Take part-time administrative jobs that will help you develop useful HR skills.,1
How to Check for a Fracture when Performing First Aid - Addressing the Broken Bone,Don't move the fractured bone. Stop any bleeding. Immobilize the injured area. Monitor for circulation. Apply cold therapy if possible.,0
How to Know Whether to Use a Cover Letter or a Value Proposition Letter - Knowing When to Use a Cover Letter,"Understand what a cover letter is. Use a cover letter if you are specifically instructed to do so by your potential employer. Send in a cover letter if the application asks you to reveal your personality. Use a cover letter if you think you might not be the best fit for the job, but you really want the job anyway. Include a cover letter when you want to include a referral.",0
How to Prevent Spider Mites on Tomato Plants - Keeping Spider Mites Away,Plant your tomato plants where they stay warm without drying out. Ensure your tomato plants are growing in loamy soil with lots of organic matter. Place hot pepper or garlic in the soil to prevent spider mites. Apply diatomaceous earth to the soil around your tomato plants. Move your tomato plants indoors to protect them if you can.,0
How to Make a Putting Green - Constructing Your Green,"Ready the soil. Add some drainage, if necessary. Separate your green to protect against weeds. Smooth the soil. Sink your putting hole.",0
How to Talk Dirty to a Guy - Building up to It,Consider your guy’s personality. Test the waters. Touch him more often. Talk about making out. Get a self-help book. Practise talking dirty by yourself. Tailor your talk to the situation. Always be sincere.,1
How to Remove Vocals from Songs - Removing the Center Channel,Start with high-quality audio tracks. Locate the vocals in the mix. Import the audio into the editing software of your choice. Break the channels into separate tracks. Select one of the channels to invert. Invert the channel. Convert the file back to mono.,1
How to Merge with Heavy Traffic - Driving After Merging,Turn off your turn signal. Maintain space. Allow other cars to merge. Repeat as needed.,0
How to Gain Authority in the Workplace - Changing From Within,Continue to get better. Be okay with not knowing. Manage your emotions.,1
How to Relieve Stress by Drawing - Relieving Stress With Illustration,Draw something that comforts you. Just draw. Be somewhere where you feel calm. Have fun.,0
How to Start a Text Conversation with a Girl - Starting a Text Conversation with a Girl,Get her phone number. Say hi — but don’t just say hi. Say something timely and relevant. Talk about her interests. Use smiley faces! Keep going!,0
How to Douche for Feminine Hygiene - Knowing When to Douche,"Know that your body cleans out vaginal discharge, blood, and semen on its own. Douche at your doctor’s suggestion. Don’t douche to remove itching or burning sensations. Don’t douche to remove a strong odor. Don’t douche in attempts to prevent STDs or pregnancy. Wash the outside of your vagina as an alternative to douching.",0
How to Sharpen a Swiss Army Knife - Finishing Up,Dry the blade. Strop the blade. Check the sharpness.,1
How to Sell or Swap Gift Cards - Selling or Swapping Gift Cards with Friends and Family,Arrange a gift card swap. Talk to friends and family about selling gift cards to them. Come up with a fair price for the gift cards.,1
How to Become a Buddhist Monk - Preparing for Monastic Life,Spend time meditating. Prepare to support yourself for two to three years. Prepare to give up your worldly possessions. Realize that your Buddhist community will become your new family. Be ready to take a vow of chastity. Decide what kind of commitment you want to make.,1
How to Stop Biting Your Nails - Covering Your Nails,Cover your nails with nail polish. Wear fake nails. Cover your nails by wearing gloves.,0
How to Apply Black Eyeshadow - Constructing an Edgy Eyeshadow Look,Prime your eyes with your primer of choice. Apply a base color all over your eyelid. Blend the color upward. Pat black eyeshadow onto the center of your eyelid. Smooth the upper edge of the black eyeshadow toward your eyebrow. Line the outer edge of your lower eyelash line in black eyeshadow.,1
How to Register a Homemade Trailer - Researching the Requirements,Contact your state’s department of motor vehicles (DMV) in the US. Ask your province’s Ministry of Transport in Canada. Check with your state’s department of transport in Australia. Contact the Driver & Vehicle Licensing Agency (DVLA) in the UK.,0
How to Lie About Your Crush Being Your Boyfriend - Lie about him asking you out,"Again, come up with a whole story, and stick with it. If you know how to write like your crush, write a note in his hand writing saying, Will you go out with me, (your name)? If you prefer, tell a story if you really do have each other's phone numbers. If you have an iPhone, there are websites where you can make fake text messages. Now come up with casual stories about dates and you're good to go!",0
How to Describe Taoism,"Consider this; a good spiritual practitioner does not worry too much about the aesthetics of his/her house. First the Philosophy of Tao. Read the Tao Te Ching and Zhuangzi as these are the two works that make up Philosophical Taoism. Research the main concepts of Taoism that apply to both Tao Philosophy and Tao religion. When it comes to the religion of Tao you must learn the pantheon of deities that make up Taoism. Now once you've done all your research find a quiet spot away from distractions, get a dictionary, a thesaurus, a notepad and a pencil.",0
How to Adopt a Retired Police Dog - Finding a Dog,Search for a place that has retired police dogs in need of adoption. Expect difficulty in finding a retired police dog available for adoption. Be persistent when contacting an adoption agency.,1
How to Upload and Download Files on Gavitex - Downloading Files,Sign into your Gavitex account. Click the cloud icon on the left panel menu. Navigate through your Gavitex folders until you find the files you’d like to download to your computer. Click the file you want to download. Download files.,0
How to Find the Surface Area of a Pyramid - Finding the Surface Area of a Square Pyramid,Set up the formula for surface area of a square pyramid. Plug in the values for the side length and slant height into the formula. Square the side length of the base. Multiply the side length of the base by the slant height and divide by two. Add the base surface area and the lateral surface area.,1
How to Decorate Your Door for Winter - Decorating Your Door without Wreaths,Use evergreen branches. Hang lettering on your door. Decorate with ornaments. Incorporate natural decorations.,0
How to Do Street Magic - Developing a Routine,String together 5 – 15 tricks into one performance. Develop a style. Practice on family and friends. Videotape your act. Take it to the streets. Sharpen your performance. Update your routine frequently with new magic tricks.,0
How to Dress More Feminine - Dressing Yourself Well,Choose clothes that fit you well. Read magazines to find the latest trends. Dress appropriately for the occasion.,0
How to Enclose a Balcony - Creating a Permanent Enclosure,Add a screen porch awning to make a shady enclosure. Install premade screen panels. Enclose your balcony with shutters.,0
How to Treat Ear Infections in Beagles - Seeking Veterinary Treatment,Schedule an appointment with your vet. Have your vet examine your beagle’s ears. Discuss treatment options with your vet. Clean and treat your beagle’s ears as prescribed.,0
How to Use Excel - Creating Charts,Set up the chart's data. Select the data. Click Insert. Click Recommended Charts. Select a chart template. Click OK. Edit your chart's title. Change your chart's axis titles.,0
How to Catalogue Your Books with Goodreads - Adding Shelves to Your Virtual Bookshelf,Visit Goodreads. Sign in. View your bookshelf. Add a shelf. Name the shelf.,1
How to Make Money in School - Saving Your Money,Open a savings account and use it. Take the bus or walk instead of driving or using a rideshare app. Shop at clearance sections and thrift stores. Sign up for a grocery store savings card.,0
How to Help Adopted Children Connect to Their Native Culture - Offering Support,Educate yourself about your child's native culture. Share interesting information about your child's native culture with them. Make it an open and celebrated topic. Enroll your child in a racially diverse school. Celebrate holidays of your adopted child's native culture. Bring in cultural elements within the home. Encourage your child to share their heritage.,0
How to Create a Simple Web Page with HTML - Adding Additional Elements to Your HTML,Add a picture to your page. Link to another page. Add a line break to your HTML.,1
How to Test the Air Quality in Your Home - Getting Professional Help,Pay a professional to test the air quality in your home. Hire a radon specialist to test for radon in your home. Use a professional test if you need an official test result.,0
How to Cope With Hunger - Avoiding Feeling Hungry,Avoid skipping meals. Eat foods high in fiber and protein. Eat foods that help you maintain energy levels. Exercise regularly. Eat mindfully.,1
How to Check Water Temperature Without a Thermometer - Determining if Water is Cold,Look for condensation on the water container. Note if ice begins to form. Check if the water is frozen.,1
How to Make Ads Work - Pair Ads with Other Promotional Strategies,Include a promotion. Combine ads with engaging activities.,1
How to Make Angel's Delight,"Take one angel food cake, and pull a large piece (about four inches wide) off. Wash your hands, and then open the can of pineapples just enough to drain the juice into a bowl (you'll need it later). Open the maraschino cherries and drain the juice into another bowl. Take a spoon and drizzle a goodly amount of the cherry and pineapple juices over the cake - about a third of the juice should suffice. Use another spoon, spread Cool Whip over the fruit layer. Sprinkle a thin layer of shredded coconut on top of the cool whip. Repeat the above steps with the remaining angel food cake, crushed pineapple, 12 more cherries, their respective juices, and cool whip. Cover and let sit in the refrigerator overnight, to let the cake absorb the juice and settle. Keep chilled until ready to serve; dole it out with a large serving spoon or spatula. Finished.",0
How to Use Microsoft Paint in Windows - Adding Text,Select a text color. Click A. Select a location for your text. Change the text's font. Change the font's size. Add formatting to the text. Increase the text box's size if necessary. Enter your text. Give your text a background if you like. Anchor your text.,1
How to Cut Parsnips - Cutting Disks on the Bias,Hold a parsnip securely on the cutting board. Hold your knife at a 45-degree angle at one end of the parsnip. Make cuts at a 45-degree angle along the length of the parsnip for disks.,1
How to Avoid Round Ligament Pain - Preventing Round Ligament Pain,Include stretching exercises as part of your daily routine. Learn about yoga during pregnancy. Use pillows. Avoid sitting or standing for long periods of time. Pay attention to your posture. Drink plenty of fluids. Use pelvic support aids. Work with a physical therapist.,0
How to Get Over a Crush - Accepting Your Feelings,Find people who know what you're feeling. Admit you have a crush. Tell your crush. Acknowledge defeat.,0
How to Watch Wildlife,Decide where you’re going to observe wildlife. Research the wildlife in your chosen location. Prepare for your expedition or outing. Blend in with your surroundings if required. Be still and wait. Approach wildlife carefully. Use your ears. Figure out what wildlife is doing. Record your observations. Learn more about what you observe.,0
How to Help a Dog Hurt in a Traffic Accident - Approaching the Dog,Speak softly to the dog. Turn your body slightly away from the dog. Move slowly. Extend a closed hand toward the dog. Determine if the dog is too aggressive to approach.,1
How to Perform a Dihybrid Cross Using the Forked‐Line Method - Setting Up the Problem,Highlight clues in the problem. Write down the genotypes for both parents. Draw two 2x2 Punnett squares. Label the Punnet square.,0
How to Tell a Friend You Need Some Space - Taking a Direct Approach,Wait until you’re not angry. Practice what you are going to say. Just say it. Establish boundaries. Be persistent.,0
How to Sign Autographs - Inking Your Autograph,Arrange instances for signing. Treat your fans with dignity and social grace. Equip yourself to autograph.,0
How to Be Independent - Navigating the World More Independently,Learn to drive or navigate public transportation. Do your own research instead of asking other people for help all the time. Learn to be handy around the house. Cook for yourself. Learn to balance your budget. Don't depend on your GPS for directions. Get used to doing things alone. Take it slowly.,0
How to Stay Organized when Moving,"Get a spiral notebook, a roll of masking tape, a pen, a Sharpie, and some sheets of labels. Make a list of all the rooms in your new home: dining room, kitchen, master bedroom, etc. Using masking tape, make tabs for your spiral notebook that match the categories you just created. Take a sheet of labels for each of your rooms, and write on the labels K-1, K-2, K-3, etc. Pack your first box. Now, on the page of your notebook for that room (for example, your K section for kitchen), write the box number and detailed information about the contents. Seal the box and slap a pre-made label or two on it. When you get to your new home, make signs to put on every door so the people unloading know where everything goes without you telling them.",1
How to Protect Plants from Animals - Spraying Repellents,Use hot pepper spray. Consider using peppermint oil to deter rodents. Use ready made repellents according to directions.,1
How to Feel Confident During Your Period - Treating Your Period Symptoms,Chart your period. Get adequate period protection. Wear clothes that make you feel comfortable. Carry pain relievers with you. Take vitamins. Wear adhesive heating pads.,1
How to Cut Tile Backsplash - Cutting Installed Tiles,"Cover your counter and put on a mask and safety goggles. Make the tile where you wish to cut it. Cut along the top, bottom, and side edges. Use an oscillating cutter to cut through tight corners. Pull the tile away.",1
How to Help Bad Knees with Yoga - Doing Intermediate Seated Yoga Poses,Do Sivananda knee bends to help relieve pressure on your knee joint and increase joint mobility. Practice Bridge pose or Setu Bandhasana pose to strengthen your knee muscles and improve knee alignment.,0
How to Properly Care for Your Guinea Pigs - Setting Up Your Guinea Pig's Cage,Purchase a large-sized horizontal cage. Choose a cage with a solid base. Avoid glass tanks or aquariums. Place the cage in a suitable location. Line your guinea pig's cage with absorbent bedding. Set up a feeding station in their cage. Purchase a large shallow food bowl for your guinea pig's vegetables. Choose between a water bottle and a water bowl. Provide your guinea pig with a place to hide. Add toys to your guinea pig's cage.,0
How to Recruit Staff - Interviewing and Hiring the New Employee,Make a shortlist of candidates. Have a multiple step interview process. Ask the right questions. Hire based on skill. Check references. Give yourself as much time as possible.,0
How to Prune a Quince Tree - Training a Young Tree,"Support young trees with stakes for 2 or 3 years. Remove the fruits in the first and second year. Prune young trees in winter and summer. Establish your desired shape in your tree's first year. Remove dead, diseased, and damaged limbs first. Use the placement of the buds to help train the tree. Cut the main trunk after the second year.",1
How to Avoid Foods That Worsen Indigestion - Identifying Troublesome Foods,Listen to your stomach. See if dairy makes your indigestion worse. Pay attention to your stress levels. Determine if particular vegetables make it worse. Try cutting down on refined carbohydrates and processed foods.,0
How to Choose a Poodle for Breeding - Picking The Right Dog,Choose a poodle size that meets AKC standard. Familiarize yourself with coat colors and consistency. Learn the typical behaviors of poodles. Spend time with puppies.,0
How to Convert MediaWiki to WordPress,"Decide on which method you'll choose for your site data transfer. Prepare for your WordPress migration, to make everything properly. Install new WordPress website and activate all the necessary plugins. Inform your site visitors about the switching and when finished, start converting your MediaWiki content to WordPress. Redesign the site. Set up 301 URLs redirects from old MediaWiki to WP.",0
How to Calculate Bond Discount Rate - Calculating the Present Value of the Bond's Principal,Gather the information. Calculate the current market interest rate for each payment period. Calculate the total number of interest payments. Calculate the Present Value Interest Factor (PVIF).,0
How to Use a Litter Box for a Rabbit - Setting up the Litterbox,Choose a standard litterbox that is low enough for your rabbit to enter. Fill the litterbox with a 1 in (2.5 cm) layer of newspaper pellet litter. Place a plastic grate over the litter to prevent scattered litter pellets. Cover the litter with hay up to the top of the litterbox.,0
How to Hire Employees Who Have High Standards - Finding the Best Candidates,Build the best reputation. Recruit in the right places. Hire a professional search firm.,0
How to Buy a Couch Online - Researching the Purchase,Take your time. Read online company reviews to find a reputable seller. Make sure the company offers a return policy you're happy with. Sign up for the company's emails.,1
